{
  "$schema": "https://json-schema.org/draft/2020-12/schema",
  "type": "object",
  "required": ["schemaVersion", "manifestDigest", "artifacts"],
  "properties": {
    "$schema": {"type": "string"},
    "schemaVersion": {"const": 1},
    "manifestDigest": {"type": ["string", "null"]},
    "generatedBy": {"type": "string"},
    "artifacts": {"type": "array", "items": {"type": "object"}}
  }
}
