{
  "$schema": "./schemas/manifest-lock.schema.json",
  "artifacts": [
    {
      "dependencies": [],
      "id": "agents.example-reviewer",
      "kind": "custom-agent",
      "namespaceId": null,
      "ownership": "shared-generated",
      "platforms": [
        "windows"
      ],
      "providers": [
        "claude",
        "codex"
      ],
      "risk": "control-confirm",
      "source": [
        "agents/example-reviewer"
      ],
      "targets": {
        "claude": "${USER_HOME}/.claude/agents/example-reviewer.md",
        "codex": "${USER_HOME}/.codex/agents/example-reviewer.toml"
      },
      "validators": [
        "no-secrets"
      ]
    },
    {
      "dependencies": [],
      "id": "instructions.global",
      "kind": "instructions",
      "namespaceId": null,
      "ownership": "shared-generated",
      "platforms": [
        "windows"
      ],
      "providers": [
        "claude",
        "codex"
      ],
      "risk": "content-auto",
      "source": [
        "instructions/global.md",
        "providers/claude/instructions.append.md",
        "providers/codex/instructions.append.md"
      ],
      "targets": {
        "claude": "${USER_HOME}/.claude/CLAUDE.md",
        "codex": "${USER_HOME}/.codex/AGENTS.md"
      },
      "validators": [
        "no-secrets"
      ]
    },
    {
      "dependencies": [],
      "id": "skills.example-checklist",
      "kind": "skill",
      "namespaceId": null,
      "ownership": "shared-link",
      "platforms": [
        "windows"
      ],
      "providers": [
        "claude",
        "codex"
      ],
      "risk": "content-auto",
      "source": [
        "skills/example-checklist"
      ],
      "targets": {
        "claude": "${USER_HOME}/.claude/skills/example-checklist",
        "codex": "${USER_HOME}/.agents/skills/example-checklist"
      },
      "validators": [
        "skill",
        "no-secrets",
        "no-machine-paths"
      ]
    },
    {
      "dependencies": [],
      "id": "skills.example-formatter",
      "kind": "skill",
      "namespaceId": null,
      "ownership": "shared-link",
      "platforms": [
        "windows"
      ],
      "providers": [
        "claude",
        "codex"
      ],
      "risk": "control-confirm",
      "source": [
        "skills/example-formatter"
      ],
      "targets": {
        "claude": "${USER_HOME}/.claude/skills/example-formatter",
        "codex": "${USER_HOME}/.agents/skills/example-formatter"
      },
      "validators": [
        "skill",
        "no-secrets",
        "no-machine-paths"
      ]
    },
    {
      "dependencies": [],
      "id": "skills.example-notes",
      "kind": "skill",
      "namespaceId": null,
      "ownership": "shared-link",
      "platforms": [
        "windows"
      ],
      "providers": [
        "claude",
        "codex"
      ],
      "risk": "content-auto",
      "source": [
        "skills/example-notes"
      ],
      "targets": {
        "claude": "${USER_HOME}/.claude/skills/example-notes",
        "codex": "${USER_HOME}/.agents/skills/example-notes"
      },
      "validators": [
        "skill",
        "no-secrets",
        "no-machine-paths"
      ]
    }
  ],
  "generatedBy": "agent-config validate --write-lock",
  "manifestDigest": "sha256:c6ed9a4e3ed87078957cc858d0e8b56b40317c38649c22ff48fc07612ba7301a",
  "schemaVersion": 1
}
